id,texto,texto_preprocesado,sentimiento,prediccion_naive_bayes,prediccion_logistic_regression
963,El panel quedo guardado sin cambios,el panel quedo guardado sin cambios,neutral,neutral,neutral
1294,El tramite impidio avanzar correctamente,el tramite impidio avanzar correctamente,negativo,negativo,negativo
983,La notificacion fue actualizado en la plataforma,la notificacion fue actualizado en la plataforma,neutral,neutral,neutral
1258,La respuesta fue dificil de completar,la respuesta fue dificil de completar,negativo,negativo,negativo
236,La informacion fue precisa y oportuna,la informacion fue precisa y oportuna,positivo,positivo,positivo
305,La herramienta fue rapida y ordenada,la herramienta fue rapida y ordenada,positivo,positivo,positivo
814,El formulario incluye datos descriptivos,el formulario incluye datos descriptivos,neutral,neutral,neutral
500,La gestion mostro un desempeno estable,la gestion mostro un desempeno estable,positivo,positivo,positivo
1135,La plataforma tuvo baja calidad,la plataforma tuvo baja calidad,negativo,negativo,negativo
490,La gestion fue confiable durante el uso,la gestion fue confiable durante el uso,positivo,positivo,positivo
918,El tramite contiene una descripcion breve,el tramite contiene una descripcion breve,neutral,neutral,neutral
47,La atencion se gestiono correctamente,la atencion se gestiono correctamente,positivo,positivo,positivo
596,El reporte tiene una fecha asignada,el reporte tiene una fecha asignada,neutral,neutral,neutral
891,La informacion fue enviado para validacion,la informacion fue enviado para validacion,neutral,neutral,neutral
595,El reporte fue marcado como recibido,el reporte fue marcado como recibido,neutral,neutral,neutral
1329,El pedido resulto insatisfactorio,el pedido resulto insatisfactorio,negativo,negativo,negativo
869,El registro se encuentra en la lista,el registro se encuentra en la lista,neutral,neutral,neutral
399,La guia entrego informacion completa,la guia entrego informacion completa,positivo,positivo,positivo
318,La herramienta fue amable y profesional,la herramienta fue amable y profesional,positivo,positivo,positivo
101,El soporte fue excelente y clara,el soporte fue excelente y clara,positivo,positivo,positivo
513,El pedido quedo guardado sin cambios,el pedido quedo guardado sin cambios,neutral,neutral,neutral
605,La factura esta disponible para consulta,la factura esta disponible para consulta,neutral,neutral,neutral
319,La herramienta permitio avanzar sin problemas,la herramienta permitio avanzar sin problemas,positivo,positivo,positivo
855,El registro esta disponible para consulta,el registro esta disponible para consulta,neutral,neutral,neutral
652,La consulta se encuentra en revision,la consulta se encuentra en revision,neutral,neutral,neutral
316,La herramienta respondio de forma adecuada,la herramienta respondio de forma adecuada,positivo,positivo,positivo
601,La factura quedo registrado en el sistema,la factura quedo registrado en el sistema,neutral,neutral,neutral
1054,El producto resulto insatisfactorio,el producto resulto insatisfactorio,negativo,negativo,negativo
780,La plataforma esta disponible para consulta,la plataforma esta disponible para consulta,neutral,neutral,neutral
683,La entrega fue actualizado en la plataforma,la entrega fue actualizado en la plataforma,neutral,neutral,neutral
1428,El reporte presento fallas constantes,el reporte presento fallas constantes,negativo,negativo,negativo
1414,La solicitud dejo una mala impresion,la solicitud dejo una mala impresion,negativo,negativo,negativo
948,La respuesta presenta opciones disponibles,la respuesta presenta opciones disponibles,neutral,neutral,neutral
764,El archivo incluye datos descriptivos,el archivo incluye datos descriptivos,neutral,neutral,neutral
439,El reporte dejo una buena impresion,el reporte dejo una buena impresion,positivo,positivo,positivo
1188,La compra se desarrollo con demoras,la compra se desarrollo con demoras,negativo,negativo,negativo
275,La respuesta mostro un desempeno estable,la respuesta mostro un desempeno estable,positivo,positivo,positivo
886,La informacion fue clasificado para revision,la informacion fue clasificado para revision,neutral,neutral,neutral
1152,El sistema no resolvio el problema,el sistema no resolvio el problema,negativo,negativo,negativo
753,El archivo muestra el estado actual,el archivo muestra el estado actual,neutral,neutral,neutral
512,El pedido esta programado para seguimiento,el pedido esta programado para seguimiento,neutral,neutral,neutral
1050,La atencion mostro un desempeno inestable,la atencion mostro un desempeno inestable,negativo,negativo,negativo
95,La entrega tuvo un resultado positivo,la entrega tuvo un resultado positivo,positivo,positivo,positivo
1457,La orientacion se interrumpio sin aviso,la orientacion se interrumpio sin aviso,negativo,negativo,negativo
660,La consulta mantiene estado activo,la consulta mantiene estado activo,neutral,neutral,neutral
270,La respuesta tuvo un resultado positivo,la respuesta tuvo un resultado positivo,positivo,positivo,positivo
89,La entrega dejo una buena impresion,la entrega dejo una buena impresion,positivo,positivo,positivo
1458,La orientacion fue dificil de completar,la orientacion fue dificil de completar,negativo,negativo,negativo
1402,La solicitud no resolvio el problema,la solicitud no resolvio el problema,negativo,negativo,negativo
379,La guia resulto muy satisfactoria,la guia resulto muy satisfactoria,positivo,positivo,positivo
1252,La respuesta no resolvio el problema,la respuesta no resolvio el problema,negativo,negativo,negativo
1277,El tramite no resolvio el problema,el tramite no resolvio el problema,negativo,negativo,negativo
972,El panel continua abierto en el sistema,el panel continua abierto en el sistema,neutral,neutral,neutral
138,La plataforma se desarrollo con eficiencia,la plataforma se desarrollo con eficiencia,positivo,positivo,positivo
1390,La guia fue poco confiable durante el uso,la guia fue poco confiable durante el uso,negativo,negativo,negativo
1446,El reporte llego en mal estado,el reporte llego en mal estado,negativo,negativo,negativo
976,La notificacion quedo registrado en el sistema,la notificacion quedo registrado en el sistema,neutral,neutral,neutral
459,La orientacion ofrecio una solucion util,la orientacion ofrecio una solucion util,positivo,positivo,positivo
1242,La informacion empeoro la experiencia general,la informacion empeoro la experiencia general,negativo,negativo,negativo
23,El servicio fue simple y practica,el servicio fue simple y practica,positivo,positivo,positivo
